{
  "schema_version": "1.1",
  "board": {
    "id": "6d164e4f319e3b4707ea3d752cad03c62dd5b2b8e3201465f4b92c7965580a8d",
    "name": "Governed editorial system",
    "n_references": 12,
    "n_eff": 12.0,
    "requested_alpha": 0.1,
    "supported_alpha": 0.07692307692307693,
    "built_at": "2026-08-17T18:58:58Z",
    "representation": {
      "style": {
        "model": "classical-v1",
        "revision": "2",
        "dim": 113
      },
      "axes": [
        "palette",
        "tone",
        "composition"
      ],
      "axis_definitions": [
        {
          "axis_id": "style",
          "label": "Style fit",
          "value_kind": "conformal_p_value",
          "direction": "higher_is_better_fit",
          "aggregation": "full_conformal_category",
          "availability": "scored_only",
          "uncertainty": "asset_interval",
          "method": {
            "name": "full-conformal-p-value",
            "revision": 1
          }
        },
        {
          "axis_id": "palette",
          "label": "Palette distance",
          "value_kind": "normalized_distance",
          "direction": "lower_is_closer",
          "aggregation": "mean_over_exemplars",
          "availability": "all_assets",
          "uncertainty": "none",
          "method": {
            "name": "palette-distance",
            "revision": 1
          }
        },
        {
          "axis_id": "tone",
          "label": "Tone distance",
          "value_kind": "normalized_distance",
          "direction": "lower_is_closer",
          "aggregation": "mean_over_exemplars",
          "availability": "all_assets",
          "uncertainty": "none",
          "method": {
            "name": "tone-distance",
            "revision": 1
          }
        },
        {
          "axis_id": "composition",
          "label": "Composition distance",
          "value_kind": "normalized_distance",
          "direction": "lower_is_closer",
          "aggregation": "mean_over_exemplars",
          "availability": "all_assets",
          "uncertainty": "none",
          "method": {
            "name": "composition-distance",
            "revision": 1
          }
        }
      ]
    },
    "fit": {
      "metric": "cosine",
      "k": 5,
      "k_cap": 5,
      "cluster_cut": 0.35,
      "dup_cut": 0.05,
      "min_category_size": 5,
      "interval_level": 0.9,
      "far_outlier_iqr_multiplier": 1.5,
      "far_outlier_iqr_multiplier_source": "docs/adr/0004-abstention.md",
      "interval": {
        "method": "loo-jackknife-plus",
        "replicates": null,
        "seed": 20260808
      }
    },
    "categories": [
      {
        "category_id": "c0",
        "n_local": 12,
        "member_ids": [
          "reference_01.png",
          "reference_02.png",
          "reference_03.png",
          "reference_04.png",
          "reference_05.png",
          "reference_06.png",
          "reference_07.png",
          "reference_08.png",
          "reference_09.png",
          "reference_10.png",
          "reference_11.png",
          "reference_12.png"
        ]
      }
    ]
  },
  "board_stats": {
    "tightness": {
      "loo_mean": 0.5416666666666665,
      "loo_sd": 0.28767104412788863,
      "loo_quantiles": {
        "p10": 0.175,
        "p50": 0.5416666666666667,
        "p90": 0.9083333333333333
      }
    },
    "leverage": [
      {
        "reference_id": "reference_10.png",
        "delta_tightness": 0.0037878787878790066,
        "rank": 1
      },
      {
        "reference_id": "reference_01.png",
        "delta_tightness": 0.0037878787878788955,
        "rank": 2
      },
      {
        "reference_id": "reference_02.png",
        "delta_tightness": 0.0037878787878788955,
        "rank": 3
      },
      {
        "reference_id": "reference_03.png",
        "delta_tightness": 0.0037878787878788955,
        "rank": 4
      },
      {
        "reference_id": "reference_04.png",
        "delta_tightness": 0.0037878787878788955,
        "rank": 5
      },
      {
        "reference_id": "reference_05.png",
        "delta_tightness": 0.0037878787878788955,
        "rank": 6
      },
      {
        "reference_id": "reference_06.png",
        "delta_tightness": 0.0037878787878788955,
        "rank": 7
      },
      {
        "reference_id": "reference_07.png",
        "delta_tightness": 0.0037878787878788955,
        "rank": 8
      },
      {
        "reference_id": "reference_08.png",
        "delta_tightness": 0.0037878787878788955,
        "rank": 9
      },
      {
        "reference_id": "reference_09.png",
        "delta_tightness": 0.0037878787878788955,
        "rank": 10
      },
      {
        "reference_id": "reference_11.png",
        "delta_tightness": 0.0037878787878788955,
        "rank": 11
      },
      {
        "reference_id": "reference_12.png",
        "delta_tightness": 0.0037878787878788955,
        "rank": 12
      }
    ],
    "flags": []
  },
  "references": [
    {
      "reference_id": "reference_01.png",
      "content_sha256": "62bb5dd28f52eb13eb2b51883f136fd60cbb9446dd7b90eb8b9ad92ec283eb6d",
      "mime": "image/png",
      "width": 480,
      "height": 320,
      "thumbnail": {
        "mime": "image/png",
        "width": 128,
        "height": 85,
        "data_base64": "iVBORw0KGgoAAAANSUhEUgAAAIAAAABVCAIAAAAOr3sAAAAG50lEQVR4nO2dW2wVRRiA55/L7ukppy2ntFwKRSVaEWM0Goo+eEPAS+INHzRBxcuL8UETfPDFR1+MxpBANJCQqKkajXgBxWiM8R5EFBCVS8tFMCK2UGjPZS8zv5lDFWpLl7J72D27+6UP5LQZJvPt/+/M7H9moXS0h6SEBw3x/05JBYRPGgEhkwoIGT7yIyEqH2IIvYk3QMG2HQ8BQoi31n60u2e/aRrnsG/xRyklOH/s0fs454g4VgT07D2w+I5FLZPySqlz28k4wxhd/tJrpbKVmzBszEcRYBgi39SQn9iQCggQxlh9NjPycz56vCAqpX905oIg+5E08N9kA3Bq4vEScCppHvKD5+U7lgAAAoQsW967vccWPA2E8YGE1Blk5dOtU/JcVnLJqHhHQM9B5+duyxCpgPGhkNRnwHZx7CDwFsAZCK5/xtmBpKOQCO59A01XwiGTCgiZVEDIpAJCJhUQMqmAkDmDlTDqxXC6Hh4vJ8YtAAH1GcjV03QhdnYLMV9bEYh6Pf3iskmOQ/SmRMo4ASDNjcyV6CsCWpoYAFRcpIwbKT3+wFuA1IksHf1q4S3ANA2g0Z0sOZYta3mG4CEAgLz97seHDveySDqQSt228Lr2GdOkZ6hHlbGfB+ib+IpVXd99v8UwBIketuNceMHMC86fEU8BJ8iYRrYuE00BnDPGohiaZ05t9z4GeEdAIoDKMmfoPgd61qfUyQfq1STZAgCAcwIUHRvLZXWk70TxAgiD5fNECGAcpes9mfdBUgUAgBBoWda2rfa2Lc6ebnX8uDx6RP8KEQyDTszzllbRcbF5xZV8WhtBRNetRkeSKAAqQ1/87NPSN1+6+/ai4xCmV/v/piCCpaIsDLq/7y9v2lhY954xe0520a3G7Eu0g6DXHIkTAKbpdO8eeP1V+5ftetw5B9Mc+VeEUWD6X1gsljd+a235Kbvolvrb76LZrBYWHEkSAACUFj/7ZPCNLlUYGG3cR4NSMEyiZOH9d5xdOxuWPsLbz0PHDqpTiZmGgi7PHFz79vHVL2O5BGKctd8AYGbsHb8efe5Zu3sXiMBWRUkRAEamuGH94Nq39Nid7bYKGIbs7z+2/AX30J96+hQEiRAAwrC3b9Ojz4XPYmPgXPb1DqxZjbYdSN1yAgQAqMLAQNcrWCqf9bU/rD3DsH7eWtiwPpBEFH8BIETxw3XOnp4AEzcYRnH9B87ePcR3Ioq7AEplf3/p6y+CStmnRlX5y8+BVuaqPoi5AODc+vEH2ddHGAu4ZSHKmzfJI30+01rMBaBS1uZNVWmaMtn7t7NrBzBfsRVrAZSqY8fcA79D0Jf/EIj2zh0+50KxFgCgCoNYKFTte24g+3oJ+todirMAYEwePKBKxSoJ0O3/cVAVfQmOswBNtZ+r+G4/7gIQI95+3AUIv3sP1W4/zgJQSj59Bq3LVikOdPtt02m23k/7cRZAEKG+nuYaqpaIkLW0EkgXYqdDKZZr4DNnVulxLqFUdFyc3oTHhFJz7rxANkH/j5R8ylTjog5dNuGDWKcgQtBxzMsu562tgZeWoOtkruqkjU0+H9PHXABBpLlc3Q03BZyFlKJN+cy1N/hvNu4CiA6C7MJbjEsu1c+wgmrTdSfcfQ9va/MfWPEXQHShlZlb8iBtbAwkEaFtZTqv1lEVRH1KAgQQna/FrAtz9y4ZKvr005Tj8OntuQce0l9aCWJ2mwgBhBC0ynXX35i7/2F9btXZxgFaFp/W1vTkU6wpjwHd1RNUmIW2nV14M21uHnhljew9rMutzhyl0HEynfNyS5ay5hZ0AyuOS5AAUkkgmavm8hntg292lTd+Rwh6F6pIia5DGyfm7lxcN3+BrpcObvQTJ4BU4oBNam18/IlM5zWlrz53fvtVFYuEgj5W9eR6DVEO7TOzyZPNy6/Mzl/A22eibftcdo0kcQI00iUAmc55mbmdzv599i/bne6dsr9f/vVX5csZCGaGtbbyyVNFx2xjzhyWb0bXRcsiVSCRAoge5ROTSN5+njh/lk7xrqMGjld+pWspIJfTJSdAqjf0yRbwH9IdyioAel/h5OcyqHnO2CRewLCTMUI4ECAp64DIkgoImVRAyKQCQiYVEDLesyBEVKgh0UNFslcBCxBCmIZhGJGcsELlQJdaZuwz4/R1v+L5Z8qWVTnJPnIgwamTW0a+GaeG8L6u26dPBQqRPbTMlTKa6TEwAa6UpFZPQ6pNAUopxhjnTKkopp0ahbFhb686rYDKKSJi5aquCROyNR3aUQMV9vYdHXnwGIx8na3rusVS+Rz2LRmgPn9y5OvxRn2VoWgSIr34g6VyDJeeWHoLiOiiq8Y53ZCmWxEhkwoImVQACZd/APBsuZkV353JAAAAAElFTkSuQmCC"
      }
    },
    {
      "reference_id": "reference_02.png",
      "content_sha256": "a1f3d5526341c49554b1377d705a4ef9663626e17f49cb6d89cacc377961b15c",
      "mime": "image/png",
      "width": 480,
      "height": 320,
      "thumbnail": {
        "mime": "image/png",
        "width": 128,
        "height": 85,
        "data_base64": "iVBORw0KGgoAAAANSUhEUgAAAIAAAABVCAIAAAAOr3sAAAAC90lEQVR4nO3dQWsTQRjG8Xl3ZjYhTYltPWg/jVcvgkfBk1fFbyCC6IcQD+LNg+KhZ7+Bd0FBLLUeLFjbQk3azryyiYXQpLuBpvNkt8+PnJa22e1/ZzcLO1nZ2fxkCCcDvjcxAB5HABgDgLnJRd4VC9WoMYJYpcbKRI6OjysCeO8+bHz8trndyr0mXLnGizF65x7cv+ucVdWyEfB96+ed27fWVnsxMsHcWJu9fP2uPxh0XWd8+ZQAuffXessrvWUGmCNrs067Nbl8SoDiBKAahy8zOg8kPBdow048p0cbGT/uVAYYVxyHEh6KxETTJFKxP5UFkOGvP3u7/GXbO3vpEaLJuvHg4Z8X3XgQGzAO1GStfP3xI7e6ovHcvap6BGz+sp+3vHcpAvSiHO5subgbG3CBopq12xpC+SCoDuCs8VZ9ihGgTow4K9FJIwLI8IqqXP23s+YYAIwBwBgAjAHAGACMAcAYAIwBwBgAjAHAGACMAcAYAIwBwBgAjAHAGACMAcAYAIwBwBgAjAHAGACMAcAYAIwBwBgAjAHAGACMAcAYAKx6BkFiToxvyjwxkeqZVosVIKj52g9LIcSU8wIviarTcEONL53kuEABMjGHUZ/+ONCjfSO1PzbGqEudo40Qu8Xsq3PVfjvrboFGwEj9p6eOTfKd4cc4AsAYAIwBwBgAjAHAGACMAcAYAIwBwBgAjAHAGACMAcAYAIwBwBgAjAHAGACMAcAYAIwBFv6uCNX/rwS0eKNC0i9svxynG3LhAN6a3OkM34J8YaImmrx4dIpvxo1ZufdV315fGqDYD9U8ubc/OJbKPzQfGsPgudFgGkEku762EkLZ5lTv2DdXY6L//oisN+juLA0nofwwVB0gpL5TOZirZEqAGNVa65zlQ3zmyNps6jn5bAAR8c6+evN+qdOu/QeRRaKqv3f3cu/PLJfJx9menIS//X7CdbsSVE2r5Vt5PsOjDL3zvptqxa6WyaPQlACzXD7QvNT+eqfuGACMAQzWPw/v2XP0kIoiAAAAAElFTkSuQmCC"
      }
    },
    {
      "reference_id": "reference_03.png",
      "content_sha256": "ed9f89c487cd4cbefb67327e1c253c03617396a199d88fbe6f743ca6cec5b990",
      "mime": "image/png",
      "width": 480,
      "height": 320,
      "thumbnail": {
        "mime": "image/png",
        "width": 128,
        "height": 85,